{
  "$schema": "http://json-schema.org/draft-04/schema#",
  "type": "object",
  "properties": {
    "offenceId": {
      "$ref": "#/definitions/uuid"
    },
    "caseId": {
      "$ref": "#/definitions/uuid"
    },
    "defendantId": {
      "$ref": "#/definitions/uuid"
    },
    "hearingId": {
      "$ref": "#/definitions/uuid"
    },
    "originHearingId": {
      "$ref": "#/definitions/uuid"
    },
    "pleaDate": {
      "type": "string"
    },
    "value": {
      "type": "string"
    }
  },
  "required": [
    "offenceId",
    "caseId",
    "defendantId",
    "hearingId",
    "originHearingId",
    "pleaDate",
    "value"
  ],
  "definitions": {
    "uuid": {
      "type": "string",
      "pattern": "[a-fA-F0-9]{8}-[a-fA-F0-9]{4}-[a-fA-F0-9]{4}-[a-fA-F0-9]{4}-[a-fA-F0-9]{12}$"
    }
  }
}