{
  "offenceId": "e085c62c-dc4a-11e7-9296-cec278b6b50a",
  "caseId": "e085c62c-dc4a-11e7-9296-cec278b6b50a",
  "defendantId": "e085c38e-dc4a-11e7-9296-cec278b6b50a",
  "hearingId": "e085c62c-dc4a-11e7-9296-cec278b6b50a",
  "originHearingId": "e085c62c-dc4a-11e7-9296-cec278b6b50a",
  "pleaDate": "2017-01-01",
  "value": "GUILTY"
}